{
  "producer": "llm-usage",
  "deliveryId": "5d1b7a3e-8f2c-4e6d-a1b0-9c8d7e6f5a4b",
  "sentAt": "2026-10-26T08:00:00+02:00",
  "payload": {
    "last7Days": {
      "costUsd": null,
      "totalTokens": 0
    },
    "monthToDate": {
      "costUsd": null,
      "totalTokens": 0,
      "cacheSavingsUsd": null,
      "agents": []
    },
    "streak": {
      "currentDays": 0,
      "longestDays": 0
    },
    "days": []
  }
}
