{
  "producer": "llm-usage",
  "deliveryId": "0f8e7c52-3c1a-4f7e-9b0a-1d2c3e4f5a6b",
  "sentAt": "2026-10-26T08:00:00Z",
  "payload": {
    "last7Days": {
      "costUsd": 41.37,
      "totalTokens": 16440000,
      "activeMs": 630000000
    },
    "monthToDate": {
      "costUsd": 152.8,
      "totalTokens": 61250000,
      "cacheSavingsUsd": 310.45,
      "agents": [
        {
          "agent": "claude",
          "costUsd": 98.1,
          "totalTokens": 39800000
        },
        {
          "agent": "codex",
          "costUsd": 41.2,
          "totalTokens": 15300000
        },
        {
          "agent": "pi",
          "costUsd": 13.5,
          "totalTokens": 6150000
        }
      ],
      "activeMs": 2790000000
    },
    "streak": {
      "currentDays": 4,
      "longestDays": 23
    },
    "days": [
      {
        "date": "2026-02-14",
        "costUsd": 20.1,
        "totalTokens": 9100000,
        "activeMs": 86400000
      },
      {
        "date": "2026-02-15",
        "costUsd": 24.9,
        "totalTokens": 11200000,
        "activeMs": 90000000
      },
      {
        "date": "2026-02-16",
        "costUsd": 0.4,
        "totalTokens": 120000,
        "activeMs": 1200000
      }
    ]
  }
}
